{
  "$comment": "Written by tools/course/sync.mjs (PLAN §8.2). Section hashes are the first 12 hex digits of the SHA-256 of normalizeForCompare(markdown); images keep the full SHA-256. Do not edit by hand.",
  "repo": "github/copilot-app-for-beginners",
  "ref": "main",
  "sha": "86bb298c6429905c16378eb720c642c74128d1d0",
  "syncedAt": "2026-10-13",
  "catalog": [
    {
      "id": "00-setup",
      "num": "00",
      "title": "Setup"
    },
    {
      "id": "01-tour-the-app",
      "num": "01",
      "title": "Tour the App"
    },
    {
      "id": "02-sessions-worktrees-context",
      "num": "02",
      "title": "Sessions, Worktrees, and Context"
    },
    {
      "id": "03-development-workflows",
      "num": "03",
      "title": "Development and GitHub Workflows"
    },
    {
      "id": "04-skills-custom-agents",
      "num": "04",
      "title": "Skills and Custom Agents"
    },
    {
      "id": "05-mcp-plugins",
      "num": "05",
      "title": "MCP Servers and Plugins"
    },
    {
      "id": "06-canvases",
      "num": "06",
      "title": "Canvases"
    },
    {
      "id": "07-automations",
      "num": "07",
      "title": "Automations"
    }
  ],
  "chapters": {
    "00-setup": {
      "short": "ch00",
      "title": "Setup",
      "hash": "5528dd890455",
      "sections": {
        "learning-objectives": {
          "title": "Learning Objectives",
          "level": 2,
          "hash": "4350d5f5c0ab",
          "terms": ["Terminal", "Estimated Time"]
        },
        "prerequisites": {
          "title": "Prerequisites",
          "level": 2,
          "hash": "8cf6b77a5305",
          "terms": ["GitHub Copilot app", "Terminal"]
        },
        "the-course-theme-working-in-a-recording-studio": {
          "title": "The Course Theme: Working in a Recording Studio",
          "level": 2,
          "hash": "5b84e8d01bdb",
          "images": ["00-setup/assets/studio-setup-soundcheck.webp"]
        },
        "installation": {
          "title": "Installation",
          "level": 2,
          "hash": "bf12cef33675",
          "images": ["00-setup/assets/app-sign-in.webp"],
          "terms": ["Sign in to GitHub", "Connect your repositories", "Continue", "New"]
        },
        "connect-to-your-repository": {
          "title": "Connect to Your Repository",
          "level": 2,
          "hash": "365638d573db",
          "images": ["00-setup/assets/app-add-project.webp"],
          "terms": [
            "+",
            "Projects",
            "Add GitHub repository",
            "Open folder",
            "Clone repository",
            "Repository URL",
            "Clone"
          ]
        },
        "check-your-tools-in-terminal": {
          "title": "Check Your Tools in Terminal",
          "level": 2,
          "hash": "6ff94698a3b3",
          "images": ["00-setup/assets/app-current-checkout-workspace-selector.webp"],
          "terms": [
            "Terminal",
            "Projects",
            "+",
            "Current checkout",
            "View",
            "Toggle Review Panel",
            "GitHub.com",
            "Login with a web browser"
          ]
        },
        "add-the-course-practice-items": {
          "title": "Add the Course Practice Items",
          "level": 2,
          "hash": "15d697dd1d02",
          "terms": ["Labels", "Issues", "Practice branches", "Pull requests", "Actions", "Terminal"]
        },
        "checklist": {
          "title": "Checklist",
          "level": 3,
          "hash": "301bbe35b7fa"
        },
        "learn-more-about-the-course-repository": {
          "title": "Learn More About the Course Repository",
          "level": 2,
          "hash": "104572df79ac",
          "terms": ["Expected Output:"]
        },
        "troubleshooting": {
          "title": "Troubleshooting",
          "level": 2,
          "hash": "947f414abd0c",
          "terms": [
            "GitHub Copilot app",
            "Sign in to GitHub Enterprise Cloud",
            "Open folder",
            "Settings",
            "Features",
            "Issues"
          ]
        },
        "i-cannot-sign-in": {
          "title": "I cannot sign in",
          "level": 3,
          "hash": "c88e34134796",
          "terms": ["GitHub Copilot app", "Sign in to GitHub Enterprise Cloud"]
        },
        "i-cannot-see-the-repository": {
          "title": "I cannot see the repository",
          "level": 3,
          "hash": "bad53698687c",
          "terms": ["Open folder"]
        },
        "a-chat-cannot-explain-the-repository": {
          "title": "A chat cannot explain the repository",
          "level": 3,
          "hash": "a31859f05301"
        },
        "the-script-stops-for-an-organization-fork": {
          "title": "The script stops for an organization fork",
          "level": 3,
          "hash": "b65840384055"
        },
        "the-script-stops-with-setup-failed": {
          "title": "The script stops with \"Setup failed\"",
          "level": 3,
          "hash": "3935f4325855"
        },
        "practice-items-were-not-created": {
          "title": "Practice items were not created",
          "level": 3,
          "hash": "f70544845f12",
          "terms": ["Settings", "Features", "Issues"]
        },
        "key-takeaways": {
          "title": "Key Takeaways",
          "level": 2,
          "hash": "4da1d85cc5fe"
        },
        "whats-next": {
          "title": "What's Next",
          "level": 2,
          "hash": "3763cb5b3b13",
          "terms": ["[← Back to Course Home](../README.md)"]
        }
      }
    },
    "01-tour-the-app": {
      "short": "ch01",
      "title": "Tour the App",
      "hash": "98dad4048f06",
      "sections": {
        "learning-objectives": {
          "title": "Learning Objectives",
          "level": 2,
          "hash": "10570b2bca05",
          "terms": ["Estimated Time"]
        },
        "prerequisites": {
          "title": "Prerequisites",
          "level": 2,
          "hash": "e19c0e167b09"
        },
        "why-use-the-github-copilot-app": {
          "title": "Why Use the GitHub Copilot app?",
          "level": 2,
          "hash": "e71d52ac5d1c",
          "images": ["01-tour-the-app/assets/editor-vs-app.webp"]
        },
        "tour-the-app": {
          "title": "Tour the App",
          "level": 2,
          "hash": "a583ed20b8e9",
          "images": [
            "01-tour-the-app/assets/app-new-page.webp",
            "01-tour-the-app/assets/app-pull-requests-page.webp",
            "01-tour-the-app/assets/app-issues-page.webp",
            "01-tour-the-app/assets/app-automations-page.webp"
          ],
          "terms": [
            "Authored by me",
            "Review requests",
            "All repositories",
            "Assigned to me",
            "Created by me",
            "New issue",
            "Automations",
            "More",
            "Edit sidebar...",
            "Projects",
            "Chats"
          ]
        },
        "new": {
          "title": "New",
          "level": 3,
          "hash": "2089b0a43f88",
          "images": ["01-tour-the-app/assets/app-new-page.webp"]
        },
        "pull-requests": {
          "title": "Pull requests",
          "level": 3,
          "hash": "b7a35175db25",
          "images": ["01-tour-the-app/assets/app-pull-requests-page.webp"],
          "terms": ["Authored by me", "Review requests", "All repositories"]
        },
        "issues": {
          "title": "Issues",
          "level": 3,
          "hash": "dd5009d56d26",
          "images": ["01-tour-the-app/assets/app-issues-page.webp"],
          "terms": ["Assigned to me", "Created by me", "New issue"]
        },
        "automations": {
          "title": "Automations",
          "level": 3,
          "hash": "6963992826ba",
          "images": ["01-tour-the-app/assets/app-automations-page.webp"],
          "terms": ["Automations"]
        },
        "customize": {
          "title": "Customize",
          "level": 3,
          "hash": "40d6c4c7a5bf"
        },
        "more": {
          "title": "More",
          "level": 3,
          "hash": "16538ba2b64e",
          "terms": ["More", "Edit sidebar..."]
        },
        "projects-and-chats": {
          "title": "Projects and Chats",
          "level": 3,
          "hash": "2e0d39688597",
          "terms": ["Projects", "Chats"]
        },
        "chats-project-sessions-and-modes": {
          "title": "Chats, Project Sessions, and Modes",
          "level": 2,
          "hash": "b86c511bd0da",
          "images": [
            "01-tour-the-app/assets/producer-control-room-modes.webp",
            "01-tour-the-app/assets/app-quick-chat.webp",
            "01-tour-the-app/assets/session-mode-decision-ladder.webp"
          ],
          "terms": [
            "+",
            "Projects",
            "Chat",
            "Expected Output:",
            "New worktree",
            "Current checkout",
            "Interactive mode",
            "Plan mode",
            "Autopilot",
            "Tool permissions",
            "Always ask",
            "Approve all",
            "Assisted"
          ]
        },
        "from-the-studio-in-the-control-room": {
          "title": "From the Studio: In the Control Room",
          "level": 3,
          "hash": "7847b6fe96d3",
          "images": ["01-tour-the-app/assets/producer-control-room-modes.webp"]
        },
        "chat-sessions": {
          "title": "Chat Sessions",
          "level": 3,
          "hash": "98f6ea579753",
          "images": ["01-tour-the-app/assets/app-quick-chat.webp"],
          "terms": ["+", "Projects", "Chat", "Expected Output:"]
        },
        "project-sessions": {
          "title": "Project Sessions",
          "level": 3,
          "hash": "b8e172159d21",
          "terms": ["New worktree", "Current checkout", "+", "Expected Output:"]
        },
        "modes": {
          "title": "Modes",